<?xml version="1.0" encoding="UTF-8"?>
<!--  Input XML document. This XML is valid against Test.xsd XML schema-->

<p7:Medicines xmlns:xsi="http://www.w3.org/2001/XMLSchema-instance"
     xmlns:p7="http://nure.ua/timoshenko/practice7"
     xsi:schemaLocation="http://nure.ua/timoshenko/practice7 input.xsd">

    <Medicine>
    <name>Nuroffen</name>
        <Pharm>NMN</Pharm>
        <Group>painkillers</Group>
        <Analogs>Ibuprofen</Analogs>
        <Analogs>Paracetamol</Analogs>
        <Versions>
            <nameVersions>pills</nameVersions>
            <Manufacturer>
                <nameManufacturer>Farmac</nameManufacturer>
                <Certificate>
                    <number>11111</number>
                    <date>2013-12-12</date>
                </Certificate>
                <Package>
                    <type>box</type>
                    <quantity>10</quantity>
                    <price>100</price>
                </Package>
                <dosage>1x3times/day</dosage>
            </Manufacturer>
            <Manufacturer>
                <nameManufacturer>Farmac</nameManufacturer>
                <Certificate>
                    <number>11111</number>
                    <date>2013-12-12</date>
                </Certificate>
                <Package>
                    <type>box</type>
                    <quantity>10</quantity>
                    <price>100</price>
                </Package>
                <dosage>1x3times/day</dosage>
            </Manufacturer>
        </Versions>
        <Versions>
            <nameVersions>powder</nameVersions>
            <Manufacturer>
                <nameManufacturer>Zdorovya</nameManufacturer>
                <Certificate>
                    <number>22222</number>
                    <date>2013-12-12</date>
                </Certificate>
                <Package>
                    <type>box</type>
                    <quantity>20</quantity>
                    <price>200</price>
                </Package>
                <dosage>1x3times/day</dosage>
            </Manufacturer>
            <Manufacturer>
                <nameManufacturer>ZZZ</nameManufacturer>
                <Certificate>
                    <number>3333</number>
                    <date>2013-12-12</date>
                </Certificate>
                <Package>
                    <type>box</type>
                    <quantity>30</quantity>
                    <price>300</price>
                </Package>
                <dosage>1x3times/day</dosage>
            </Manufacturer>
        </Versions>
            </Medicine>
    <Medicine>
    <name>LizaK</name>
    <Pharm>Medic</Pharm>
    <Group>painkillers</Group>
    <Analogs>Lisobact</Analogs>
    <Analogs>Ingalipt</Analogs>
    <Versions>
        <nameVersions>capsules</nameVersions>
        <Manufacturer>
            <nameManufacturer>Farmac</nameManufacturer>
            <Certificate>
                <number>33333</number>
                <date>2013-12-12</date>
            </Certificate>
            <Package>
                <type>box</type>
                <quantity>10</quantity>
                <price>130</price>
            </Package>
            <dosage>1x3times/day</dosage>
        </Manufacturer>
    </Versions>
    <Versions>
        <nameVersions>powder</nameVersions>
        <Manufacturer>
            <nameManufacturer>Zdorovya</nameManufacturer>
            <Certificate>
                <number>44444</number>
                <date>2014-01-16</date>
            </Certificate>
            <Package>
                <type>box</type>
                <quantity>20</quantity>
                <price>250</price>
            </Package>
            <dosage>1x3times/day</dosage>
        </Manufacturer>
        <Manufacturer>
            <nameManufacturer>ZZZ</nameManufacturer>
            <Certificate>
                <number>3333</number>
                <date>2001-01-18</date>
            </Certificate>
            <Package>
                <type>box</type>
                <quantity>40</quantity>
                <price>400</price>
            </Package>
            <dosage>1x3times/day</dosage>
        </Manufacturer>
    </Versions>
</Medicine>
</p7:Medicines>